{
  "$schema": "https://json-schema.org/draft/2020-12/schema",
  "$id": "urn:deckweft:theme-pack",
  "type": "object",
  "properties": {
    "id": {
      "enum": [
        "cream-collage",
        "dark-data",
        "electric-violet",
        "silver-gray-editorial",
        "fresh-report",
        "orange-launch"
      ]
    },
    "version": {
      "const": "1.0.0"
    },
    "attribution": {
      "type": "string",
      "maxLength": 2000
    },
    "palette": {
      "type": "object",
      "properties": {
        "paper": {
          "type": "string",
          "pattern": "^#[a-fA-F0-9]{6}$"
        },
        "ink": {
          "type": "string",
          "pattern": "^#[a-fA-F0-9]{6}$"
        },
        "accent": {
          "type": "string",
          "pattern": "^#[a-fA-F0-9]{6}$"
        },
        "secondary": {
          "type": "string",
          "pattern": "^#[a-fA-F0-9]{6}$"
        },
        "reference": {
          "type": "string",
          "pattern": "^#[a-fA-F0-9]{6}$"
        },
        "missing": {
          "type": "string",
          "pattern": "^#[a-fA-F0-9]{6}$"
        }
      },
      "required": [
        "paper",
        "ink",
        "accent",
        "secondary"
      ],
      "additionalProperties": false
    },
    "typography": {
      "type": "object",
      "properties": {
        "displayEn": {
          "type": "string",
          "maxLength": 300
        },
        "displayZh": {
          "type": "string",
          "maxLength": 300
        },
        "bodyEn": {
          "type": "string",
          "maxLength": 300
        },
        "bodyZh": {
          "type": "string",
          "maxLength": 300
        },
        "code": {
          "type": "string",
          "maxLength": 300
        },
        "displayScale": {
          "type": "number",
          "minimum": 0.7,
          "maximum": 1.4
        },
        "numeric": {
          "type": "string",
          "minLength": 1,
          "maxLength": 300
        },
        "roles": {
          "description": "CINE-006: the six type roles in px at 1440 px (1 px = 2/3 pt in PowerPoint): title, lead, body, label, reference, numeric.",
          "type": "object",
          "properties": {
            "title": {
              "type": "integer",
              "minimum": 8,
              "maximum": 96
            },
            "lead": {
              "type": "integer",
              "minimum": 8,
              "maximum": 96
            },
            "body": {
              "type": "integer",
              "minimum": 8,
              "maximum": 96
            },
            "label": {
              "type": "integer",
              "minimum": 8,
              "maximum": 96
            },
            "reference": {
              "type": "integer",
              "minimum": 8,
              "maximum": 96
            },
            "numeric": {
              "type": "integer",
              "minimum": 8,
              "maximum": 96
            }
          },
          "required": [
            "title",
            "lead",
            "body",
            "label",
            "reference",
            "numeric"
          ],
          "additionalProperties": false
        }
      },
      "required": [
        "displayEn",
        "displayZh",
        "bodyEn",
        "bodyZh",
        "code",
        "displayScale"
      ],
      "additionalProperties": false
    },
    "spacing": {
      "type": "object",
      "properties": {
        "page": {
          "type": "number",
          "minimum": 24,
          "maximum": 80
        },
        "gap": {
          "type": "number",
          "minimum": 12,
          "maximum": 60
        },
        "captionGap": {
          "type": "number",
          "minimum": 0,
          "maximum": 60
        },
        "sectionGap": {
          "type": "number",
          "minimum": 0,
          "maximum": 120
        },
        "safeArea": {
          "type": "number",
          "minimum": 0,
          "maximum": 120
        }
      },
      "required": [
        "page",
        "gap"
      ],
      "additionalProperties": false
    },
    "imageGrammar": {
      "type": "object",
      "properties": {
        "split": {
          "type": "number",
          "minimum": 0.3,
          "maximum": 0.7
        },
        "treatment": {
          "enum": [
            "hard-edge",
            "full-height",
            "evidence"
          ]
        },
        "caption": {
          "enum": [
            "visible"
          ]
        }
      },
      "required": [
        "split",
        "treatment",
        "caption"
      ],
      "additionalProperties": false
    },
    "chartColors": {
      "type": "array",
      "items": {
        "type": "string",
        "pattern": "^#[a-fA-F0-9]{6}$"
      },
      "minItems": 2,
      "maxItems": 8
    },
    "compositions": {
      "type": "array",
      "items": {
        "enum": [
          "diagonal-cover",
          "chart-with-evidence-rail",
          "reading-flow",
          "photo-split",
          "violet-chapter",
          "fieldnotes-cover",
          "fieldnotes-thesis",
          "fieldnotes-figure",
          "fieldnotes-method",
          "fieldnotes-closing",
          "atlas-cover",
          "atlas-section",
          "atlas-figure",
          "atlas-panels",
          "atlas-appendix",
          "atlas-closing",
          "stage-hero",
          "stage-chapter",
          "stage-figure",
          "stage-metric",
          "stage-closing",
          "statement-split",
          "statement-banner",
          "statement-center",
          "image-left",
          "image-strip",
          "image-right",
          "metric-left",
          "metric-band",
          "metric-right",
          "evidence-left",
          "evidence-top",
          "evidence-right",
          "comparison-matrix",
          "comparison-rail",
          "comparison-stack",
          "process-line",
          "process-rail",
          "process-stair",
          "chapter-low",
          "chapter-index",
          "chapter-margin",
          "before-after-split",
          "before-after-rail",
          "before-after-triptych",
          "system-map-wide",
          "system-map-rail",
          "system-map-key",
          "small-multiples-row",
          "small-multiples-lead",
          "small-multiples-center",
          "quote-center",
          "quote-split",
          "quote-band",
          "closing-split",
          "closing-steps",
          "closing-focus"
        ]
      },
      "minItems": 1,
      "maxItems": 57,
      "uniqueItems": true
    },
    "density": {
      "enum": [
        "comfortable",
        "compact"
      ]
    },
    "motion": {
      "type": "object",
      "properties": {
        "durationMs": {
          "type": "number",
          "minimum": 0,
          "maximum": 600
        },
        "effect": {
          "enum": [
            "none",
            "fade"
          ]
        },
        "distance": {
          "type": "number",
          "minimum": 0,
          "maximum": 80
        },
        "easing": {
          "enum": [
            "linear",
            "ease",
            "ease-in",
            "ease-out",
            "ease-in-out"
          ]
        },
        "delay": {
          "type": "number",
          "minimum": 0,
          "maximum": 600
        },
        "fallback": {
          "enum": [
            "instant",
            "static"
          ]
        }
      },
      "required": [
        "durationMs",
        "effect"
      ],
      "additionalProperties": false
    },
    "modes": {
      "type": "object",
      "properties": {
        "default": {
          "enum": [
            "light",
            "dark",
            "violet"
          ]
        },
        "chapter": {
          "enum": [
            "light",
            "dark",
            "violet"
          ]
        }
      },
      "required": [
        "default",
        "chapter"
      ],
      "additionalProperties": false
    },
    "rules": {
      "type": "array",
      "items": {
        "type": "object",
        "properties": {
          "sceneRole": {
            "enum": [
              "any",
              "opening",
              "evidence"
            ]
          },
          "mode": {
            "enum": [
              "any",
              "default",
              "chapter"
            ]
          },
          "property": {
            "enum": [
              "composition",
              "contrast"
            ]
          },
          "value": {
            "type": "string",
            "maxLength": 200
          },
          "severity": {
            "enum": [
              "prefer",
              "require"
            ]
          },
          "rationale": {
            "type": "string",
            "maxLength": 500
          }
        },
        "required": [
          "sceneRole",
          "mode",
          "property",
          "value",
          "severity",
          "rationale"
        ],
        "additionalProperties": false
      },
      "minItems": 1,
      "maxItems": 20
    }
  },
  "required": [
    "id",
    "version",
    "attribution",
    "palette",
    "typography",
    "spacing",
    "imageGrammar",
    "chartColors",
    "compositions",
    "density",
    "motion",
    "modes",
    "rules"
  ],
  "additionalProperties": false
}
